{
    "$schema": "https://json-schema.org/draft/2020-12/schema",
    "type": "object",
    "properties": {
        "name": {
            "type": "string",
            "description": "The name of the service"
        },
        "group": {
            "type": "string",
            "description": "The group identifier this service belongs to"
        },
        "description": {
            "type": "object",
            "properties": {
                "en": {
                    "type": "string",
                    "description": "The English description of the service"
                },
                "de": {
                    "type": "string",
                    "description": "The German description of the service"
                }
            },
            "required": ["en", "de"]
        },
        "domains": {
            "type": "array",
            "description": "A list of domains associated with the service",
            "items": {
                "type": "string",
                "pattern": "^(?:\\*\\.)?(?:[a-zA-Z0-9](?:[a-zA-Z0-9-]{0,61}[a-zA-Z0-9])?\\.)+(?:[a-zA-Z]{2,}|\\*)$"
            }
        }
    },
    "required": ["name", "group", "description", "domains"],
    "additionalProperties": false
}
