{
    "name": "Discord",
    "group": "social",
    "description": {
        "en": "A versatile communication platform for communities, gamers, and professionals, featuring voice, video, and text chat.",
        "de": "Eine vielseitige Kommunikationsplattform für Communities, Gamer und Profis mit Sprach-, Video- und Textchat."
    },
    "domains": [
        "discord.com",
        "discord.gg",
        "discord.media",
        "discordapp.com",
        "discordapp.net",
        "discord.gift",
        "discordapp.gift"
    ]
}
