{
    "name": "Skype",
    "group": "messenger",
    "description": {
        "en": "A communication platform for calls and messaging.",
        "de": "Eine Kommunikationsplattform für Anrufe und Nachrichten."
    },
    "domains": [
        "edge-skype-com.s-0001.s-msedge.net",
        "skype-edf.akadns.net",
        "skype.com",
        "skype.net",
        "skypeassets.com",
        "skypeassets.net",
        "skypedata.akadns.net",
        "skype.*"
    ]
}
