{
    "name": "Shopify",
    "group": "shopping",
    "description": {
        "en": "An e-commerce platform that enables individuals and businesses to create and customize their own online stores.",
        "de": "Eine E-Commerce-Plattform, die es Einzelpersonen und Unternehmen ermöglicht, ihre eigenen Online-Shops zu erstellen und anzupassen."
    },
    "domains": [
        "shopify.com"
    ]
}
