{
    "name": "Nintendo",
    "group": "gaming",
    "description": {
        "en": "A gaming platform by Nintendo.",
        "de": "Eine Gaming-Plattform von Nintendo."
    },
    "domains": [
        "nintendo-europe.com",
        "nintendo.be",
        "nintendo.co.jp",
        "nintendo.co.uk",
        "nintendo.com",
        "nintendo.com.au",
        "nintendo.de",
        "nintendo.es",
        "nintendo.eu",
        "nintendo.fr",
        "nintendo.it",
        "nintendo.jp",
        "nintendo.net",
        "nintendo.nl",
        "nintendo.pt",
        "nintendoswitch.cn",
        "nintendowifi.net"
    ]
}
